code,name,bao_hanh,base_price,slase_price,img_directory,infor_product
PCMD021,Trọn bộ tản nhiệt nước PC Thermaltake Core P3 (Lắp ráp theo yêu cầu),24 tháng,9999000,9251000,Categories/img/Fan/250_42811_modding_pc_thermaltake_core_p3_ht_18_1.jpg,"- Tản nhiệt nước Custom là giải pháp làm mát cao cấp nhất giành cho các bộ máy tính Desktop PC, tăng khả năng làm mát cho hệ thống từ 20-50%, ngoài ra giảm độ ồn tới 50% do diện tích toả nhiệt lớn cùng vẻ đẹp khó cưỡng là những lý do mà những hệ thống PC Gaming, Workstation ngày càng sử dụng tản nhiệt nước nhiều hơn .- Với các linh kiện được lựa chọn kỹ càng, đến từ các thương hiệu hàng đầu thế giới, những hệ thống Modding PC Made by HANOICOMPUTER đảm bảo hoạt động bền bỉ và đem lại vẻ đẹp độc đáo cho hệ thống của bạn .- Lưu ý: .- - Khách hàng có thể tuỳ chọn màu nước theo ý thích .- - Khách hàng có thể tuỳ biến đường nước theo ý thích, chi phí có thể tăng hoặc giảm tuỳ thuộc đường nước khách hàng yêu cầu  ."
FANB100,EK-Quantum Magnitude D-RGB - AM4 Nickel + Plexi,24 tháng,0,6299000,Categories/img/Fan/250_51558_ek_quantum_magnitude_d_rgb_am4_nickel_plexi_0002_3.jpg,"- EK-Quantum Magnitude là Block CPU thuộc phân khúc xa xỉ được thiết kế riêng của EK mang lại hiệu năng tản nhiệt số 1 thế giới, nhưng vẫn đảm bảo được độ cản nước cực thấp..- Phiên bản AM4 của Block này là sự kết hợp hoàn hảo giữa phân bổ đường nước, lực ép xuống CPU và thiết kế rãnh nước dành cho các CPU AMD sử dụng Socket AM4..- Block CPU EK Magnitude được đánh giá là có hiệu năng tốt nhất ở thời điểm hiện tại."
FANB074,EK-Velocity RGB - Nickel + Plexi,24 tháng,0,2679000,Categories/img/Fan/250_43975_ek_velocity_rgb___nickel_plexi_0002_3.jpg,- No information
FANB115,EK-Quantum Magnitude - AM4 Full Nickel,24 tháng,7999000,7349000,Categories/img/Fan/250_53999_ek_quantum_magnitude___am4_full_nickel_0004_1__3_.jpg,"- EK-Quantum Magnitude là Block CPU thuộc phân khúc xa xỉ được thiết kế riêng của EK mang lại hiệu năng tản nhiệt số 1 thế giới, nhưng vẫn đảm bảo được độ cản nước cực thấp. Phiên bản AM4 của Block này là sự kết hợp hoàn hảo giữa phân bổ đường nước, lực ép xuống CPU và thiết kế rãnh nước dành cho các CPU AMD sử dụng Socket AM4.- Phiên bản Full Nickel với toàn bộ block làm bằng kim loại, đem lại vẻ bề ngoài sang trọng cho các bộ máy cao cấp nhất trên thị trường."
FAVG076,EK-Vector Strix RTX 2070 RGB - Nickel + Plexi,24 tháng,0,3599000,Categories/img/Fan/250_45576_ek_vector_strix_rtx_2070_rgb_nickel_plexi_0001_2.jpg,"- Block nước hiệu năng cao được thiết kế đặc biệt cho phiên bản ROG Strix của card đồ họa NVIDIA® GeForce® RTX 2060 và 2070 .- Block nước sử dụng kiểu dáng mỏng đặc trưng của EK®, và nó bao phủ toàn bộ chiều dài PCB. .- Giải pháp làm mát cao cấp này sẽ biến card đồ họa ROG mạnh mẽ của bạn thành một khối nhỏ gọn, ấn tượng với đèn LED RGB ở LOGO.."
FAVG158,EK-Quantum Vector Radeon RX 5700 +XT D-RGB - Nickel + Acetal,24 tháng,4299000,3779000,Categories/img/Fan/250_55108_ek_quantum_vector_radeon_rx_5700__xt_d_rgb___nickel___acetal_0004_1__2_.jpg,- Block VGA hiệu năng cao dành riêng cho các dòng card đồ hoạ AMD Radeon RX 5700 - 5700XT sử dụng bo mạch refer.- Tích hợp led D-RGB.- Sản phẩm thuộc seri EK-Quantum cao cấp của EK.
RADI066,Bitspower Leviathan SF 240 4xG1/4 inch Radiator (BP-NLSF240-F4PB),24 tháng,1799000,1699000,Categories/img/Fan/250_45906_bitspower_leviathan_sf_240_4xg14_radiator_bp_nlsf240_f4pb_0001_2.jpg,- No information
PUMP101,EK-D5 PWM G2 Motor (12V DC Pump Motor) - Sleeved,24 tháng,0,2549000,Categories/img/Fan/250_51479_ek_d5_pwm_g2_motor__12v_dc_pump_motor____sleeved_0001_1__1_.jpg,- Bơm Xylem D5 hiệu năng cao và có điều tốc thông qua PWM bằng BIOS hoặc các bộ điều khiển tốc độ quạt khác. Đây là phiên bản mới được nâng cấp của D5 mang lại hiệu năng và độ ổn định vượt trội.
PUMP079,EK-XRES 100 DDC 3.2 PWM Elite (incl. pump),24 tháng,4509000,3699000,Categories/img/Fan/250_45102_ek_xres_100_ddc_3_2_pwm_elite__incl__pump__0000_1.jpg,- EK-XRES 100 DDC 3.2 PWM Elite (bao gồm máy bơm) là máy bơm làm mát nước hiệu suất cao với tank tích hợp.Sản phẩm này cũng cung cấp hiệu suất bơm tăng (lên đến 15%) so với máy bơm nước Laing DDC cơ bản..
PUMP105,EK-Quantum Reflection Evolv X D5 PWM D-RGB - Plexi,24 tháng,8549000,8349000,Categories/img/Fan/250_52147_ek_quantum_reflection_evolv_x_d5_pwm_d_rgb_plexi_0003_4.jpg,- EK-Quantum Reflection Evolv X D5 PWM D-RGB là giải pháp bảng nước trọn bộ kèm bơm tương thích với case Phanteks Evolv X và P600s..
TANK076,EK-RES X3 150,24 tháng,0,1779000,Categories/img/Fan/250_37490_ek_res_x3_150_0001_1__2_.jpg,- The EK-RES X3 reservoir from EK CSQ design line is an improved version of renown EK-Multioption RES X2 reservoirs released three years ago..- .- PLEASE NOTE: .- - Do not use or clean reservoir with alcohol derivates or other solvents as acrylic may crack!.
NUEK004,EK-CryoFuel Solid Cloud White (Premix 1000mL),24 tháng,729000,629000,Categories/img/Fan/250_44219_ek_cryofuel_solid_cloud_white__premix_1000ml__0002_1__2_.jpg,- Dung dịch tản nhiệt chuyên dụng loại pha sẵn 1000mL.- (KHÔNG CẦN PHA THÊM NƯỚC CẤT).- Sản phẩm có tông màu trắng đục.
FITT300,EK-Torque HTC-14 - Nickel,24 tháng,0,169000,Categories/img/Fan/250_48399_ek_torque_htc_14___nickel_0000_layer_2.jpg,"- Fit ống cứng 14 mm mới của EK được thiết kế để sử dụng với các ống rắn như Acrylic và PETG. Với thiết kế nổi bật và đồng nhất, cũng như không chèn logo trên sản phẩm mang lại vẻ đẹp cao cấp. Chúng có thể được bổ sung bởi các vòng màu có thể hoán đổi cho nhau ( ban riêng ), và là một lựa chọn lý tưởng cho bất kỳ ai cũng như là một kết hợp hoàn hảo với các sản phẩm dòng EK-Quantum.."
FITT219,Fitting Freezemod G1/4 Plug Silver,24 tháng,0,99000,Categories/img/Fan/250_41880_fitting_freezemod_g14_plug_silver_1.jpeg,- No information
FITT296,EK-Torque Angled 45° - Black,24 tháng,0,279000,Categories/img/Fan/250_47236_ek_torque_angled_45_____black_0000_1__2_.jpg,- No information
FITT234,EK-AF T-Splitter 3F G1/4 - Nickel,24 tháng,0,229000,Categories/img/Fan/250_46370_ek_af_t_splitter_3f_g14___nickel_0001_1__3_.jpg,- No information
FITT311,EK-Torque HTC-14 Color Rings Pack - Blue (10pcs),24 tháng,0,369000,Categories/img/Fan/250_49657_ek_torque_htc_14_color_rings_pack___blue__10pcs__0001_1__1_.jpg,- EK-Torque HTC 14 Color Rings Pack là các vòng màu thay đổi dành cho fitting 14mm mới của EK được thiết kế để sử dụng với ống cứng OD 14mm như Acrylic và PETG. Chúng được làm bằng nhôm anode.
FITT321,EK-AF Extender 30mm M-F G1/4 - Black,24 tháng,0,159000,Categories/img/Fan/250_49930_ek_af_extender_30mm_m_f_g14___black_0000_49930_ek_af_extender_30mm_m_f_g1_4_black_3.jpg,- EK-AF Extender G1 / 4 phù hợp để nối dài ren G1/4 từ Block để gắn những fitting bị vướng bởi linh kiện hoặc dùng để nối dài ren.
FITT387,EK-Quantum Flow Indicator D-RGB – Nickel,24 tháng,1299000,1099000,Categories/img/Fan/250_56063_ek_quantum_flow_indicator_d_rgb_____nickel__6_.jpg,"- Chong chóng tới từ thương hiệu EKWB với vẻ đẹp đơn giản và tinh tế.- Phiên bản màu nickel bóng, cho độ hoàn thiện và vẻ bề ngoài cực kỳ cao cấp.- Hỗ trợ đèn led D-RGB 5v dễ dàng đồng bộ màu sắc.- Hỗ trợ theo dõi nước chảy trong hệ thống tản nhiệt."
ONGT041,Corsair Hydro X Series XT Hardline - Satin Black (3x1m 10/14mm ID/OD PMMA) (CX-9059008-WW) ,24 tháng,699000,589000,Categories/img/Fan/250_54283_corsair_hydro_x_series_xt_hardline___satin_black__3x1m_1014mm_idod_pmma_0000_1__1_.jpg,- Ống dẫn nước dành cho tản nhiệt nước Custom .- Đem tới vẻ đẹp sang trong nhờ tông màu đen mờ.- Làm từ chất liệu nhựa PMMA.
AIEK009,EK-Pro CPU Quick Disconnect Kit,24 tháng,0,2999000,Categories/img/Fan/250_51376_ek_pro_cpu_quick_disconnect_kit_1.jpg,"- EK-Pro CPU Quick Disconnect Kit là giải pháp hiệu quả nhất để biến chiếc CPU trở thành mô đun nước rời một cách dễ dàng. Bộ KIT bao gồm: 1 mét ống ZMT 6.9/15.9mm,  fitting dạng barb 10mm, 4 kẹp ống và 2 bộ kit Fitting Quick Disconnect."
CAUV005,Cầu nối Gigabyte GC-A2WAY NVLINK RGB (6cm),24 tháng,1659000,1459000,Categories/img/Fan/250_44935_gigabyte_gc_a2way_nvlink_rgb_6cm.png,- No information
PUMP029,Pump Bykski XPH-PA ( Pump Only ),24 tháng,0,399000,Categories/img/Fan/250_33390_pump_bykski_xph_pa_pump_only.jpg,- No information
PUMP118,EK-Quantum Reflection PC-O11D XL D5 PWM D-RGB - Plexi,12 tháng,11999000,11299000,Categories/img/Fan/250_56059_ek_quantum_reflection_pc_o11d_xl_d5_pwm_d_rgb___plexi_0005_1__5_.jpg,- Tấm nước mặt trước của case Lian Li PC O11 XL với kích thước lớn và trong suốt..- Trang bị bơm D5 cao cấp cho lưu lượng nước chảy cao.- Tích hợp đèn D-RGB đem tới hiệu ứng ánh sáng tuyệt đẹp.- Thuộc dòng sản phẩm cao cấp của hãng với chất lượng và độ hoàn thiện cao cấp tuyệt vời.
FITT160,Fitting Bitspower OD14 Silver Shining,24 tháng,0,139000,Categories/img/Fan/250_36813_bitspower_od14_silver_shining_0000_1.jpg,- No information
FITT370,EK-Quantum Torque 6-Pack STC 10/13 - Nickel,24 tháng,1029000,939000,Categories/img/Fan/250_53065_ek_quantum_torque_6_pack_stc_1013___nickel_0001_1__1_.jpg,- Fit cắm ống mềm thuộc dòng sản phẩm Quantum cao cấp của EK.- Thiết kế độc đáo cùng độ hoàn thiện tinh xảo tuyệt vời.- Có khả năng tùy biến bằng cách lắp thêm các vòng Ring có màu sắc tùy chọn.- Tương thích với nhiều loại ống khác nhau..- Phù hợp với các size ống mềm 10/13.
FITT030,Fitting Barrow Extend 20mm Male - Female Matt Black,24 tháng,0,99000,Categories/img/Fan/250_29483_fitting_barrow_extend_20mm_male_female_matt_black_1.jpg,"- Fitting dùng để nối dài ren thay vì sử dụng ống.- Bao gồm 1 ren G1/4 female và 1 ren G1/4 male.- Sử dụng ren G1/4 phổ thông, tương thích 99% các linh kiện tản nước hiện tại.- Màu đen.- Độ dài 20mm."
NUEK019,EK-CryoFuel Lime Yellow (Premix 1000mL),24 tháng,0,629000,Categories/img/Fan/250_48403_ek_cryofuel_lime_yellow__premix_1000ml__0001_1__3_.jpg,- Dung dịch tản nhiệt chuyên dụng loại pha sẵn 1000mL.- (KHÔNG CẦN PHA THÊM NƯỚC CẤT).- Sản phẩm có tông màu vàng chanh trong suốt.
CABS008,Cáp Riser Li-Heat PCI-Express 16x 3.0 (25cm) Type-A,24 tháng,1399000,999000,Categories/img/Fan/250_44468_cable_riser_li_heat_pci_express_16x_30_30cm_type_a_1.jpg,- No information
TOOL060,EK-Cable PWM Fan Extension (30cm),24 tháng,0,119000,Categories/img/Fan/250_54712_ek_cable_pwm_fan_extension__30cm__0000_file_132_3.jpg,- Cable nối dài truyền dẫn tín hiệu PWM và cấp nguồn cho các loại quạt và bơm nước chuyên dụng sử dụng chân cắm PWM 4 pin.
PUMP072,Pump Freezemod PU-FS4 ( RGB ),24 tháng,0,999000,Categories/img/Fan/250_55290_pump_freezemod_pu_fs4___rgb___5_.jpg,- Material: Acrylic + ABS.- Model: PU-FS4-J.- Rated current: 0.7A.- Rated function: 8W.- Pump head: 4 meters.
FITT149,Fitting Bitspower OD14 Silver Shining. ,24 tháng,0,159000,Categories/img/Fan/250_36204_bitspower_od14_silver_shining_0000_1.jpg,- No information
FITT339,Corsair Hydro X Series XF Hardline 4-pack (14mm OD compression; glossy white) (CX-9052013-WW ),24 tháng,829000,729000,Categories/img/Fan/250_52181_corsair_hydro_x_series_xf_hardline_4_pack__14mm_od_compression__glossy_white__0000_1__3_.jpg,- Phù hợp hoàn hảo cho các hệ thống tản nhiệt nước có sử dụng ống cứng 14mm.
FITT368,EK-Quantum Torque 6-Pack HTC 12 - Black,24 tháng,1239000,1089000,Categories/img/Fan/250_52671_ek_quantum_torque_6_pack_htc_12___black_0004_1__1_.jpg,- Fit cắm ống thuộc dòng sản phẩm Quantum cao cấp của EK.- Thiết kế độc đáo cùng độ hoàn thiện tinh xảo tuyệt vời.- Có khả năng tùy biến bằng cách lắp thêm các vòng Ring có màu sắc tùy chọn.- Tương thích với nhiều loại ống khác nhau..
FITT083,Fitting Thermaltake Pacific Adapter 4-way Chrome (CL-W034-CU00SL-A),24 tháng,0,269000,Categories/img/Fan/250_33078_fitting_thermaltake_pacific_adapter_4_way_chrome__cl_w034_cu00sl_a__0000_1.jpg,"- Fitting chia 4 đường nước, hoặc gộp đường nước .- Bao gồm 4 ren female G1/4 .- Sử dụng ren G1/4 phổ thông, tương thích 99% các linh kiện tản nước hiện tại .- Màu chrome."
FITT206,Bitspower G1/4 inch Silver Shining Dual Rotary 90-Degree IG1/4 inch Extender,24 tháng,0,389000,Categories/img/Fan/250_38213_bitspower_g14_inch_silver_shining_dual_rotary_90_degree_ig14_inch_extender_0000_1.jpg,- No information
FITT122,Fitting Bykski Extend 20mm Male - Female Silver Shining   ,24 tháng,0,59000,Categories/img/Fan/250_35666_tb29jgzo1j8pufjy1xbxxagqvxa___68100854.jpg,- No information
FANC569,Tản nhiệt CPU Cooler Master MasterAir 610P, 24 tháng ,1299000,1139000,Categories/img/Fan/250_42167_tan_nhiet_cpu_cooler_master_masterair_610p_0001_6.jpg,- Cooler Master MasterAir 610P đem tới hiệu suất vượt trội.- Sản phẩm hướng tới đối tượng người dùng game thủ muốn đạt tới hiệu suất phần cứng đạt được cao nhất và độ ổn định tối đa.- Thiết kế phù hợp với đa phần các cấu hình thông dụng trên thị trường..- Quạt RGB đi kèm có thể tuỳ chình màu sắc.
FANC727,Tản nhiệt khí CPU Xigmatek WINDPOWER PRO (EN44276),24 tháng,1059000,999000,Categories/img/Fan/250_51243_xigmatek_winpower_pro_11.jpg,"- Hiệu năng cao cấp với công nghệ ống đồng tiếp xúc trực tiếp của Xigmatek.- Hai quạt cho lượng gió thổi lớn.- Hoàn thiện với ống đồng và lá tản nhiệt mạ đen.- Hỗ trợ đa số các dòng CPU trên thị trường.- Đèn led ARGB trên nóc, quạt và đèn đồng bộ màu được với mainboard."
FANC747,Tản nhiệt khí ID-Cooling SE-224-W,24 tháng,649000,589000,Categories/img/Fan/250_52795_id_cooling_se_224_w__0002_1__2_.jpg,- Mẫu tản nhiệt 4 ống đồng tiếp xúc trực tiếp cho hiệu năng làm mất cao.- Tông màu trắng độc đáo..- Khả năng tương thích với nhiều socket khác nhau..- Sử dụng quạt 120mm tối ưu lượng gió..
FANC774,Tản nhiệt khí Jonsbo CR-1000 White,6 tháng,469000,399000,Categories/img/Fan/250_54828_jonsbo_cr_1000_white_0004_1__3_.jpg,- Mẫu sản phẩm tản nhiệt với thiết kế độc đáo gồm đèn RGB ở quạt và logo RGB phát sáng trên nóc..- Công nghệ 4 ống dẫn nhiệt tiếp xúc trực tiếp với bề mặt CPU - cho khả năng giải nhiệt nhanh chóng..- Tông màu trắng đem lại vẻ độc đáo cho bộ máy của bạn khi kết hợp với các linh kiện màu trắng khác..
FANA492,EK-Furious Vardar EVO 120 BB (750-3000rpm),24 tháng,0,629000,Categories/img/Fan/250_44908_ek_furious_vardar_evo_120_bb_750_3000rpm_0003_1__3_.jpg,"- EK-Furious Vardar EVO 120 BB là quạt tản nhiệt nước chuyên dụng, kếp hợp hiệu quả với các sản phẩm EKWB."
FANA551,EK-Vardar X3M 120ER D-RGB (500-2200rpm) - White,24 tháng,0,939000,Categories/img/Fan/250_51380_ek_vardar_x3m_120er_d_rgb_500_2200rpm_black_0005_6.jpg,"- Mẫu quạt hiệu năng cao, đặc biệt phù hợp để cho các giải pháp tản nhiệt của những bộ máy hàng đầu.- Phiên bản mới nâng cấp lên LED D-RGB 5v cùng khả năng đồng bộ màu với mainboard.- Cánh quạt được thiết kế lại đem tới luồn gió tập trung và tăng cường áp suất gió.- Trục trang bị vòng bi kép đem tới tuổi thọ vượt trội so với các loại trục dầu thông thường, đặc biệt trong môi trường nhiệt độ cao."
KEOT037,Kem tản nhiệt Deepcool Z9 (Xi lanh),24 tháng,0,229000,Categories/img/Fan/250_33463_kem_tan_nhiet_deepcool_z9_xi_lanh_0000_1.jpg,- - Độ dẫn nhiệt tốt hơn .- - Không dễ cháy. .- - Hiệu năng tốt trong tầm giá .- - Không chứa bất kỳ kim loại hoặc vật liệu dẫn điện khác..
DENL262,Bộ đèn LED Ambient Ambino Black 29-32-34-35 inches,24 tháng,999000,799000,Categories/img/Fan/250_51647_bo_led_dan_man_hinh_ambino_black_8.jpg,"- Sản phẩm đèn LED Ambient cho màn hình 29-32-34-35 inches.- Kết nối dễ dàng thông qua hệ thống lắp đặt đơn giản, nhanh chóng.- Điều khiển trực tiếp thông qua phần mềm Việt hoá Adrilight."
PCMD025,Trọn bộ tản nhiệt nước PC Cooler Master MasterCase (Lắp ráp theo yêu cầu),24 tháng,0,5999000,Categories/img/Fan/250_43232_modding_pc_coolermaster_mastercase_ht_22_1.jpg,"- Tản nhiệt nước Custom là giải pháp làm mát cao cấp nhất giành cho các bộ máy tính Desktop PC, tăng khả năng làm mát cho hệ thống từ 20-50%, ngoài ra giảm độ ồn tới 50% do diện tích toả nhiệt lớn cùng vẻ đẹp khó cưỡng là những lý do mà những hệ thống PC Gaming, Workstation ngày càng sử dụng tản nhiệt nước nhiều hơn .- Với các linh kiện được lựa chọn kỹ càng, đến từ các thương hiệu hàng đầu thế giới, những hệ thống Modding PC Made by HANOICOMPUTER đảm bảo hoạt động bền bỉ và đem lại vẻ đẹp độc đáo cho hệ thống của bạn .- Lưu ý: .- - Khách hàng có thể tuỳ chọn màu nước theo ý thích .- - Khách hàng có thể tuỳ biến đường nước theo ý thích, chi phí có thể tăng hoặc giảm tuỳ thuộc đường nước khách hàng yêu cầu  ."
PCMD046,Trọn bộ tản nhiệt nước PC CoolerMaster C700M HT-41 ABYSSAL CRYSTAL (Lắp ráp theo yêu cầu),24 tháng,0,24612000,Categories/img/Fan/250_45787_modding_pc_coolermaster_c700m_ht_41_abyssal_crystal_1.jpg,"- Tản nhiệt nước Custom là giải pháp làm mát cao cấp nhất giành cho các bộ máy tính Desktop PC, tăng khả năng làm mát cho hệ thống từ 20-50%, ngoài ra giảm độ ồn tới 50% do diện tích toả nhiệt lớn cùng vẻ đẹp khó cưỡng là những lý do mà những hệ thống PC Gaming, Workstation ngày càng sử dụng tản nhiệt nước nhiều hơn .- Với các linh kiện được lựa chọn kỹ càng, đến từ các thương hiệu hàng đầu thế giới, những hệ thống Modding PC Made by HANOICOMPUTER đảm bảo hoạt động bền bỉ và đem lại vẻ đẹp độc đáo cho hệ thống của bạn .- Lưu ý: .- - Khách hàng có thể tuỳ chọn màu nước theo ý thích .- - Khách hàng có thể tuỳ biến đường nước theo ý thích, chi phí có thể tăng hoặc giảm tuỳ thuộc đường nước khách hàng yêu cầu  ."
FANC684,Tản nhiệt nước ID Cooling AuraFlow X240 RGB TGA,24 tháng,1849000,1499000,Categories/img/Fan/250_48200_tan_nhiet_nuoc_id_cooling_auraflow_x240_rgb_tga_0005_6.jpg,- No information
FANC605,Tản nhiệt nước Corsair Hydro Series H115i RGB PLATINUM ,24 tháng,4590000,3999000,Categories/img/Fan/250_45018_tan_nhiet_nuoc_corsair_hydro_series_h115i_rgb_platinum_0004_1.jpg,"- Hai quạt RGB CORSAIR ML140 RGB, cung cấp tới 16 hiệu ứng chuyển màu, tăng cường lượng gió thổi.- Chế độ Zero RPM Mode hoàn toàn yên tĩnh khi tạm dừng quạt ở mức nhiệt độ CPU thấp.- Phần mềm iCUE tuỳ chỉnh thông minh toàn bộ tốc độ cũng như màu sắc của hệ thống.- Block và bơm thiết kế hạn chế tối đa tiếng ồn mà vẫn đạt hiệu suất ấn tượng.- Radiator 280mm mở rộng bề mặt làm mát và hiệu quả giải nhiệt."
CABL467,Bộ dây nối dài bọc lưới cao cấp Sleeve Cable - Red / Black,24 tháng,1099000,899000,Categories/img/Fan/250_47943_sleeve_cable_red_black_1.jpg,- No information
PCMD001,Trọn bộ tản nhiệt nước PC Cooler Master H500P (Lắp ráp theo yêu cầu),24 tháng,0,12656000,Categories/img/Fan/250_41662_modding_pc_h500p_ht_01_1.jpg,"- Tản nhiệt nước Custom là giải pháp làm mát cao cấp nhất giành cho các bộ máy tính Desktop PC, tăng khả năng làm mát cho hệ thống từ 20-50%, ngoài ra giảm độ ồn tới 50% do diện tích toả nhiệt lớn cùng vẻ đẹp khó cưỡng là những lý do mà những hệ thống PC Gaming, Workstation ngày càng sử dụng tản nhiệt nước nhiều hơn .- Với các linh kiện được lựa chọn kỹ càng, đến từ các thương hiệu hàng đầu thế giới, những hệ thống Modding PC Made by HANOICOMPUTER đảm bảo hoạt động bền bỉ và đem lại vẻ đẹp độc đáo cho hệ thống của bạn .- Lưu ý: .- - Khách hàng có thể tuỳ chọn màu nước theo ý thích .- - Khách hàng có thể tuỳ biến đường nước theo ý thích, chi phí có thể tăng hoặc giảm tuỳ thuộc đường nước khách hàng yêu cầu  ."
PCMD019,Trọn bộ tản nhiệt nước PC Cooler Master H500P  (Lắp ráp theo yêu cầu),24 tháng,0,29479000,Categories/img/Fan/250_42572_modding_pc_cooler_master_h500p_ht_17_1.jpg,"- Tản nhiệt nước Custom là giải pháp làm mát cao cấp nhất giành cho các bộ máy tính Desktop PC, tăng khả năng làm mát cho hệ thống từ 20-50%, ngoài ra giảm độ ồn tới 50% do diện tích toả nhiệt lớn cùng vẻ đẹp khó cưỡng là những lý do mà những hệ thống PC Gaming, Workstation ngày càng sử dụng tản nhiệt nước nhiều hơn .- Với các linh kiện được lựa chọn kỹ càng, đến từ các thương hiệu hàng đầu thế giới, những hệ thống Modding PC Made by HANOICOMPUTER đảm bảo hoạt động bền bỉ và đem lại vẻ đẹp độc đáo cho hệ thống của bạn .- Lưu ý: .- - Khách hàng có thể tuỳ chọn màu nước theo ý thích .- - Khách hàng có thể tuỳ biến đường nước theo ý thích, chi phí có thể tăng hoặc giảm tuỳ thuộc đường nước khách hàng yêu cầu  ."
PCMD049,Trọn bộ tản nhiệt nước  PC LianLi O11 DYNAMIC HT-44 (Lắp ráp theo yêu cầu),24 tháng,0,39056000,Categories/img/Fan/250_47511_lian_li_pc_o11_modding_12.jpg,"- Tản nhiệt nước Custom là giải pháp làm mát cao cấp nhất giành cho các bộ máy tính Desktop PC, tăng khả năng làm mát cho hệ thống từ 20-50%, ngoài ra giảm độ ồn tới 50% do diện tích toả nhiệt lớn cùng vẻ đẹp khó cưỡng là những lý do mà những hệ thống PC Gaming, Workstation ngày càng sử dụng tản nhiệt nước nhiều hơn .- Với các linh kiện được lựa chọn kỹ càng, đến từ các thương hiệu hàng đầu thế giới, những hệ thống Modding PC Made by HANOICOMPUTER đảm bảo hoạt động bền bỉ và đem lại vẻ đẹp độc đáo cho hệ thống của bạn .- Lưu ý: .- - Khách hàng có thể tuỳ chọn màu nước theo ý thích .- - Khách hàng có thể tuỳ biến đường nước theo ý thích, chi phí có thể tăng hoặc giảm tuỳ thuộc đường nước khách hàng yêu cầu  ."
FANB030,Block CPU XSPC Raystorm Pro ( Intel ) Black,24 tháng,2249000,1999000,Categories/img/Fan/250_35591_block_cpu_xspc_raystorm_pro___intel___black_0002_1__1_.jpg,- Block CPU dành cho tản nhiệt nước Custom.- Hỗ trợ các Socket của Intel: 20xx/115x.
FANB084,EK-Annihilator EX/EP Square,24 tháng,0,3199000,Categories/img/Fan/250_45823_ek_annihilator_ex_ep_square_0005_6.jpg,- No information
FANB111,AMD Mounting Kit Classic  ,24 tháng,249000,199000,Categories/img/Fan/250_53531_amd_mounting_kit_classic.jpg,- Gông bắt block CPU Classic của EK dành cho các dòng CPU AMD..- Dùng để thay thế gông bắt nguyên bản của dòng block EK-Supremacy Classic.
FAVG130,EK-Vector Radeon RX 5700 +XT Backplate - Black	,24 tháng,0,889000,Categories/img/Fan/250_47681_ek_vector_radeon_rx_5700__xt_backplate___black.png,- No information
RADI041,Radiator Bykski B-RD120-TN.,24 tháng,0,649000,Categories/img/Fan/250_35654_radiator_bykski_b_rd120_tn_0002_3.jpg,- Kích thước: 121 x 28 x 155mm.- Chất liệu vỏ: Nhôm.- Chất liệu lá tản: Đồng.- Mật độ lá tản FPI:16.- Ren sử dụng:G1/4.
PUMP070,EK-DDC 3.2 (12V PWM pump),24 tháng,0,2259000,Categories/img/Fan/250_43189_ek_ddc_3_2__12v_pwm_pump__0000_1__2_.jpg,- Bơm Laing DDC-3.2 chuyên dụng cho hệ thống tản nhiệt nước với nâng cấp điều tốc PWM.
