code,name,bao_hanh,base_price,slase_price,img_directory,infor_product
FANC448,Tản nhiệt CPU Cooler Master Hyper 212 LED,24 tháng,849000,689000,Categories/img/Fan/250_33693_tan_nhiet_cpu_cooler_master_hyper_212_led_0004_1.jpg,- Bốn ống dẫn nhiệt công nghệ Direct Contact giữa CPU và bộ tản nhiệt.- Có thể nâng cấp lên 2 quạt tản nhiệt chỉ bằng thao tác ráp ngàm kẹp quạt tản linh động.- Quạt PWM khổ rộng với thiết kế cánh quạt độc quyền và đèn LED đỏ.- Bộ chân tản đa nền tảng dành cho socket bo mạch chủ Intel và AMD.- Thiết kế ngàm kẹp quạt tối ưu giúp quá trình lắp đặt dễ dàng.
FANC745,Tản Nhiệt Khí CoolerMaster Hyper 212 Spectrum ,24 tháng,999000,749000,Categories/img/Fan/250_52775_coolermaster_hyper_212_spectrum__3_.jpg,- Hỗ trợ Socket: Intel® LGA 2066/2011-v3 / 2011 / 1200 /1151 / 1150 / 1155 / 1156 / 1366 / 775.- AMD AM4/AM3+ / AM3 / AM2+ / AM2 / FM2+ / FM2 / FM1 .- 4 ống dẫn nhiệt với các lá tản nhiệt nhôm.- Trang bị quạt SF120R với đèn ARGB có hiệu ứng màu sắc vô cùng độc đáo và khả năng điều chỉnh tốc độ cho độ ồn thấp..
FANC771,Tản nhiệt khí Jonsbo CR-1100 Grey,6 tháng,1199000,1089000,Categories/img/Fan/250_54825_jonsbo_cr_1100_grey__2_.jpg,"- Mẫu sản phẩm tản nhiệt với thiết kế độc đáo gồm đèn RGB ở quạt và logo RGB phát sáng trên nóc..- Công nghệ ống dẫn nhiệt tiếp xúc trực tiếp với bề mặt CPU - cho khả năng giải nhiệt nhanh chóng..- 2 quạt làm mát, cho lượng gió thổi qua lớn, tăng cường hiệu suất..- Tông màu xám đem lại vẻ đẹp cứng cáp và mạnh mẽ.."
FANC772,Tản nhiệt khí Jonsbo CR-1100 Pink,6 tháng,1199000,1089000,Categories/img/Fan/250_54826__jonsbo_cr_1100_pink_0005_1__1_.jpg,"- Mẫu sản phẩm tản nhiệt với thiết kế độc đáo gồm đèn RGB ở quạt và logo RGB phát sáng trên nóc..- Công nghệ ống dẫn nhiệt tiếp xúc trực tiếp với bề mặt CPU - cho khả năng giải nhiệt nhanh chóng..- 2 quạt làm mát, cho lượng gió thổi qua lớn, tăng cường hiệu suất..- Tông màu trắng hồng kết hợp cho phong cách cực kỳ độc đáo.."
FANC721,Tản nhiệt khí Jonsbo CR-1000 GT,24 tháng,599000,569000,Categories/img/Fan/250_51069_jonsbo_cr_1000_gt_1.jpg,"- Tản nhiệt dạng tháp với 4 ống dẫn nhiệt.- Quạt đi kèm 120mm, áp lực gió lớn, tuổi thọ cao.- Quạt và logo phía bên trên trang bị đèn ARGB, đồng bộ màu với các phần mềm của mainboard."
FANC668,Fan CPU Noctua NH-U12S,24 tháng,0,1869000,Categories/img/Fan/250_47790_fan_cpu_noctua_nh_u12s_0000_1__1_.jpg,"- Mẫu quạt tản nhiệt đến từ thương hiệu nổi tiếng Noctua.- Hiệu năng tản nhiệt cao cấp, tương đương các mẫu tản nhiệt quạt 140mm.- Các ống tản nhiệt dạng tháp, trang bị 1 quạt 120mm chất lượng cao, tăng cường tuổi thọ và giảm độ ồn."
FANC764,Tản nhiệt khí ID-Cooling CPU SE-224 XT Basic,24 tháng,659000,649000,Categories/img/Fan/250_53822_id_cooling_cpu_se_224_xt_basic_0001_1__5_.jpg,"- Trang bị quạt áp lực gió cao.- Công nghệ 4 ống dẫn nhiệt tiếp xúc trực tiếp với bề mặt CPU.- Chân bắt thiết kế khoa học, tối ưu hóa khả năng tương thích của sản phẩm.- Các lá tản thiết kế đặc biệt tạo nên diện tích trao đổi nhiệt tối đa."
FANA443,Fan Case Corsair LL140 RGB 140mm Dual Light Loop RGB LED 2 Fan Pack with Lighting Node PRO,24 tháng,2689000,2499000,Categories/img/Fan/250_38917_fan_case_corsair_ll140_rgb_140mm_dual_light_loop_rgb_led_2_fan_pack_with_lighting_node_pro_0000_1__14_.jpg,- Kích thước: 140mm x 25mm.- Vòng quay/phút: 600-1300.- Điện áp hoạt động: 7V - 13.2V.- Luồng khí: 51.5 CFM.- Độ ồn: 25 dBA.
FANA529,Fan Case Corsair LL120 RGB 120mm Dual Light Loop RGB LED 3 Fan Pack with Lighting Node PRO - White,24 tháng,0,2899000,Categories/img/Fan/250_47891_fan_case_corsair_ll120_rgb_120mm_dual_light_loop_rgb_led_3_fan_pack_with_lighting_node_pro_white_0009_1__1_.jpg,"- Fan RGB led ring độc đáo, tuỳ chỉnh 16.8 triệu màu.- Số vòng quay: 600 RPM - 1500 RPM.- Thiết kế phù hợp với mọi loại case..- Kích thước quạt: 120mm x 25mm..- Tông màu trắng độc đáo."
FANA559,EK-Vardar EVO 120ER D-RGB (500-2200 rpm),12 tháng,899000,799000,Categories/img/Fan/250_53057_ek_vardar_evo_120er_d_rgb__500_2200_rpm__0001_1__5_.jpg,"- Sản phẩm quạt đến từ thương hiệu nổi tiếng EKWB với chất lượng vượt trội, hiệu suất cao và áp suất gió kinh ngạc.- Quạt EK-Vardar EVO 120ER D-RGB đặc biệt phù hợp cho các hệ thống tản nhiệt nước Custom..- Dựa trên nguyên mẫu dòng quạt Vardar EVO ra mắt lần đầu vào năm 2014. Nay mẫu sản phẩm này còn được trang bị thêm đèn led D - RGB cho hiệu ứng ánh sáng nổi bật..- Toàn bộ đèn led và tốc độ quạt đều có thể điều chỉnh dễ dàng thông qua các phần mềm của mainboard thông dụng. Chân điều tốc PWM cho khả năng vận hành vô cùng êm ái.."
FANA577,Fan Case NOCTUA NF-A12x15 Black -Slim fan,72 tháng,799000,699000,Categories/img/Fan/250_56820_noctua_nf_a12x15_black_0001_1__1_.jpg,"- Quạt làm mát đến từ thương hiệu nổi tiếng cho hiệu suất cao và bền bỉ.- Kích thước mỏng, phù hợp với các hệ thống có không gian hạn chế."
KEOT047,Keo tản nhiệt NOCTUA NT-H2 3.5g,24 tháng,0,269000,Categories/img/Fan/250_47798_noctua_nt_h2_0002_1__2_.jpg,"- Keo tản nhiệt hiệu năng cao cấp.- Là phiên bản nâng cấp của NT-H1 từng đoạt giải thưởng.- Dễ dàng thoa đều hay lau sạch, độ dẫn điện cực thấp, không gây chập cháy trong quá trình sử dụng.- Thời gian sử dụng lâu dài, tuýp 3,5g sử dụng được lên tới 20 lần.."
DENL258,Bộ đèn LED dán case Ambino Node Rainbow ( Hub + 2 x LED D-RGB 25cm ),24 tháng,499000,349000,Categories/img/Fan/250_49914_ambino_node_rainbow_hub_1_x_led_d_rgb_25cm_15.jpg,"- Hiệu ứng nháy theo nhạc chuyển động mượt mà.- Dây nối chịu dòng cao, bọc xác rắn, chắc chắn sẽ chống chọi được với những pha “bẻ gập” khi bạn lắp đặt trong case.- Toàn bộ dây LED sử dụng nam châm để dễ dàng gắn vào case, thêm vào đó là sự hỗ trợ của các thỏi nam châm đất hiếm, giúp bạn gá lắp chắc chắn hơn rất nhiều….- Điều khiển hiệu ứng bằng phần mềm Adrilight thông qua Hub đi kèm."
PCMD035,Trọn bộ tản nhiệt nước PC Cooler Master H500P  (Lắp ráp theo yêu cầu),24 tháng,0,13124000,Categories/img/Fan/250_44864_modding_pc_coolermaster_h500p_ht_30_black_sparkle_1.jpg,"- Tản nhiệt nước Custom là giải pháp làm mát cao cấp nhất giành cho các bộ máy tính Desktop PC, tăng khả năng làm mát cho hệ thống từ 20-50%, ngoài ra giảm độ ồn tới 50% do diện tích toả nhiệt lớn cùng vẻ đẹp khó cưỡng là những lý do mà những hệ thống PC Gaming, Workstation ngày càng sử dụng tản nhiệt nước nhiều hơn .- Với các linh kiện được lựa chọn kỹ càng, đến từ các thương hiệu hàng đầu thế giới, những hệ thống Modding PC Made by HANOICOMPUTER đảm bảo hoạt động bền bỉ và đem lại vẻ đẹp độc đáo cho hệ thống của bạn .- Lưu ý: .- - Khách hàng có thể tuỳ chọn màu nước theo ý thích .- - Khách hàng có thể tuỳ biến đường nước theo ý thích, chi phí có thể tăng hoặc giảm tuỳ thuộc đường nước khách hàng yêu cầu  ."
FANC558,Tản nhiệt nước CPU Hydro Series™ H150i PRO RGB 360mm Liquid CPU Cooler,24 tháng,0,5289000,Categories/img/Fan/250_41137_tan_nhiet_nuoc_cpu_hydro_series_h150i_pro_rgb_360mm_liquid_cpu_cooler_0004_5.jpg,- No information
FANC626,Tản nhiệt nước Asus ROG RYUO 240 - RGB 240mm Liquid CPU Cooler,24 tháng,5089000,4699000,Categories/img/Fan/250_45765_rog_ryuo_240.jpg,"- Màn hình màu OLED 1.77inch cung cấp thông tin tình trạng hệ thống hoặc tuỳ chỉnh hoạt ảnh cá nhân.- Thiết kế quạt ROG được tối ưu để đem đến áp suất gió lớn.- Thiết kế nắp đậy phần bơm với đèn addressable RGB được mạ chân không đem đến cảm giác sang trọng, cứng cáp.- Phong cách thiết kế đồng bộ với các linh kiện của ASUS ROG.- Dây dẫn nước được bện tăng cường tuổi thọ cho linh kiện."
FANC732,Tản nhiệt nước CPU NZXT Kraken X63, 72 tháng ,4299000,3999000,Categories/img/Fan/250_51279_kraken_x63_1.jpg,"- Phần pump với vòng LED ARGB vô cực và logo NZXT phát sáng độc đáo.- Vòng sáng lớn hơn 10% với thế hệ cũ đem tới nhiều ánh sáng hơn.- Tuỳ chỉnh tất cả thông số và đèn thông qua phần mềm CAM.- Quạt Aer 120P thổi Radiator đem lại hiệu suất mạnh mẽ, độ ồn thấp, tuổi thọ cao.- Dây nối bọc dù cứng cáp kèm khả năng xoay đầu dây thuận tiện cho việc bố trí lắp đặt."
CABL469,Bộ dây nối dài bọc lưới cao cấp Sleeve Cable - Green / Black,24 tháng,1099000,899000,Categories/img/Fan/250_47945__mg_9831.jpg,- No information
PCMD009,Trọn bộ tản nhiệt nước PC Cooler Master H500P  (Lắp ráp theo yêu cầu),24 tháng,0,11676000,Categories/img/Fan/250_41895_modding_pc_cooler_master_h500p_st_02_1.jpg,"- Tản nhiệt nước Custom là giải pháp làm mát cao cấp nhất giành cho các bộ máy tính Desktop PC, tăng khả năng làm mát cho hệ thống từ 20-50%, ngoài ra giảm độ ồn tới 50% do diện tích toả nhiệt lớn cùng vẻ đẹp khó cưỡng là những lý do mà những hệ thống PC Gaming, Workstation ngày càng sử dụng tản nhiệt nước nhiều hơn .- Với các linh kiện được lựa chọn kỹ càng, đến từ các thương hiệu hàng đầu thế giới, những hệ thống Modding PC Made by HANOICOMPUTER đảm bảo hoạt động bền bỉ và đem lại vẻ đẹp độc đáo cho hệ thống của bạn .- Lưu ý: .- - Khách hàng có thể tuỳ chọn màu nước theo ý thích .- - Khách hàng có thể tuỳ biến đường nước theo ý thích, chi phí có thể tăng hoặc giảm tuỳ thuộc đường nước khách hàng yêu cầu  ."
PCMD027,Trọn bộ tản nhiệt nước PC LianLi O11WX (Lắp ráp theo yêu cầu),24 tháng,0,26295000,Categories/img/Fan/250_43650_modding_pc_lianli_o11wx_mixi_v1_0_ht_24_1.jpg,"- Tản nhiệt nước Custom là giải pháp làm mát cao cấp nhất giành cho các bộ máy tính Desktop PC, tăng khả năng làm mát cho hệ thống từ 20-50%, ngoài ra giảm độ ồn tới 50% do diện tích toả nhiệt lớn cùng vẻ đẹp khó cưỡng là những lý do mà những hệ thống PC Gaming, Workstation ngày càng sử dụng tản nhiệt nước nhiều hơn .- Với các linh kiện được lựa chọn kỹ càng, đến từ các thương hiệu hàng đầu thế giới, những hệ thống Modding PC Made by HANOICOMPUTER đảm bảo hoạt động bền bỉ và đem lại vẻ đẹp độc đáo cho hệ thống của bạn .- Lưu ý: .- - Khách hàng có thể tuỳ chọn màu nước theo ý thích .- - Khách hàng có thể tuỳ biến đường nước theo ý thích, chi phí có thể tăng hoặc giảm tuỳ thuộc đường nước khách hàng yêu cầu  ."
PCMD074,Trọn bộ tản nhiệt nước PC C700M AORUS- HT66 (Lắp ráp theo yêu cầu),24 tháng,0,27075000,Categories/img/Fan/250_56681_c700m_aorus_modding_watercooling__12_.jpg,"- Tản nhiệt nước Custom là giải pháp làm mát cao cấp nhất giành cho các bộ máy tính Desktop PC, tăng khả năng làm mát cho hệ thống từ 20-50%, ngoài ra giảm độ ồn tới 50% do diện tích toả nhiệt lớn cùng vẻ đẹp khó cưỡng là những lý do mà những hệ thống PC Gaming, Workstation ngày càng sử dụng tản nhiệt nước nhiều hơn .- Với các linh kiện được lựa chọn kỹ càng, đến từ các thương hiệu hàng đầu thế giới, những hệ thống Modding PC Made by HANOICOMPUTER đảm bảo hoạt động bền bỉ và đem lại vẻ đẹp độc đáo cho hệ thống của bạn .- Lưu ý: .- - Khách hàng có thể tuỳ chọn màu nước theo ý thích .- - Khách hàng có thể tuỳ biến đường nước theo ý thích, chi phí có thể tăng hoặc giảm tuỳ thuộc đường nước khách hàng yêu cầu  ."
FANB062,EK-Annihilator EX/EP,24 tháng,0,4299000,Categories/img/Fan/250_42179_ek_annihilator_exep_0000_1.jpg,"- The EK-Annihilator EX/EP là đế tản nhiệt nước tiêu chuẩn dành riêng cho hệ thống server 1U hoặc chassis, tương thích với socket LGA 3647 (Socket P) Intel® processors. Đế tản nhiệt này trang bị gông Narrow ILM.."
FAVG114,EK-FC RTX 2080 + Ti Classic RGB - Nickel + Plexi   ,24 tháng,0,3219000,Categories/img/Fan/250_46450_ek_fc_rtx_2080_ti_classic_rgb_nickel_plexi_0003_4.jpg,"- Block nước sử dụng kiểu dáng mỏng đặc trưng của EK®, và nó bao phủ toàn bộ chiều dài PCB. Giải pháp làm mát cao cấp này sẽ biến card đồ họa mạnh mẽ của bạn thành một phần cứng gọn gàng với logo có đèn LED RGB.."
FAVG081,EK-Quantum Vector Strix RTX 2080 Ti Backplate - Nickel,24 tháng,0,1469000,Categories/img/Fan/250_45581_ek_vector_strix_rtx_2080_ti_backplate_nickel_0000_1.jpg,"- Backplate ốp phía sau card đồ hoạ, ngoài tác dụng trang trí, backplate còn có tác dụng bảo vệ bo mạch của card và tản nhiệt ở phía mặt lưng.."
FANM031,EK-Quantum Momentum ROG Rampage VI Encore D-RGB - Plexi,24 tháng,5199000,4899000,Categories/img/Fan/250_52674_ek_quantum_momentum_rog_rampage_vi_encore_d_rgb___plexi__0001_1__7_.jpg,"- Monoblock thuộc dòng sản phẩm cao cấp Quantum Line mới được thiết kế riêng cho bo mạch chủ ROG Rampage VI Extreme Encore. Với tính năng mát mới nhất với độ cản nước thấp và hiệu suất cao. Monoblock được trang bị dải đèn LED 3 chân D-RGB (có thể đánh địa chỉ) và nó cung cấp khả năng tùy biến thẩm mỹ vô song bên cạnh hiệu suất vượt trội! Đèn LED D-RGB trong monoblock tương thích với ASUS® Aura Sync, mang đến trải nghiệm vô cùng độc đáo với đầy đủ sắc màu.."
RADI052,EK-CoolStream PE 240 (Dual),24 tháng,0,1889000,Categories/img/Fan/250_37478_radiator_ek_coolstream_pe_240_dual_0002_3.jpg,- EK-CoolStream PE là két tản nhiệt nước chuyên dụng với thiết kế đặc biệt ưu việt..- Là sản phẩm tản nhiệt tốt nhất trong phân khúc độ dày 40mm!.
RADI069,EK-CoolStream Classic SE 360,24 tháng,0,1629000,Categories/img/Fan/250_46515_radiator_ek_coolstream_classic_se_360_0002_3.jpg,- EK-CoolStream Classic SE là két tản nhiệt nước chuyên dụng với thiết kế đặc biệt ưu việt..- Là sản phẩm tản nhiệt tốt nhất trong phân khúc độ dày 30mm!.
TOOL050,EK-Revo D5 Pump Mount,24 tháng,0,259000,Categories/img/Fan/250_51478_ek_revo_d5_pump_mount_0000_1.jpg,- EK-Revo D5 Pump Mount đi kèm cao su mềm giúp giảm rung máy bơm! EK-Revo D5 Pump Mount được thiết kế để sử dụng với máy bơm D5 và các sản phẩm XTOP D5 từ dòng Revo. Trong ảnh là EK-Revo D5 Pump Mount với bơm D5 cùng với bộ tổ hợp XRES..
TANK047,Tank Bitspower Z-Multi Ultra 150 POM,24 tháng,0,1599000,Categories/img/Fan/250_35594_bitspower_z_multi_ultra_150_pom_0000_1.jpg,- Tank chứa nước dành cho tản nhiệt nước Custom.- Tank có chiều cao 150mm.
TANK080,EK-RES X3 110,24 tháng,0,300000,Categories/img/Fan/250_37494_ek_res_x3_110_0000_37494_ek_resx3_100_800.jpg,- The EK-RES X3 reservoir from EK CSQ design line is an improved version of renown EK-Multioption RES X2 reservoirs released three years ago..- .- PLEASE NOTE: .- - Do not use or clean reservoir with alcohol derivates or other solvents as acrylic may crack!.
NUEK008,EK-CryoFuel Clear (Premix 1000mL),24 tháng,729000,629000,Categories/img/Fan/250_45104_ek_cryofuel_clear__premix_1000ml__0000_layer_2.jpg,- Dung dịch tản nhiệt chuyên dụng loại pha sẵn 1000mL.- (KHÔNG CẦN PHA THÊM NƯỚC CẤT).- Sản phẩm có tông màu trắng trong suốt.
FITT034,Fitting Barrow Lightning ( nhiều màu )  ,24 tháng,0,89000,Categories/img/Fan/250_29482_fitting_barrow_lightting_1.jpg,"- Fitting chiếu sáng có độ sáng mạnh, dùng để chiếu sáng tank cho hiệu ứng đẹp mắt.- Sử dụng ren G1/4 phổ thông, tương thích 99% các linh kiện tản nước hiện tại.- Có màu trắng, đỏ, xanh dương, xanh lá."
FITT299,EK-Torque HTC-14 - Black,24 tháng,0,199000,Categories/img/Fan/250_48398_ek_torque_htc_14___black_0000_layer_2.jpg,"- Fit ống cứng 14 mm mới của EK được thiết kế để sử dụng với các ống rắn như Acrylic và PETG. Với thiết kế nổi bật và đồng nhất, cũng như không chèn logo trên sản phẩm mang lại vẻ đẹp cao cấp. Chúng có thể được bổ sung bởi các vòng màu có thể hoán đổi cho nhau ( ban riêng ), và là một lựa chọn lý tưởng cho bất kỳ ai cũng như là một kết hợp hoàn hảo với các sản phẩm dòng EK-Quantum.."
FITT264,EK-Torque HTC-12 Color Rings Pack - Purple ( 10 pcs ),24 tháng,0,419000,Categories/img/Fan/250_47204_ek_torque_htc_14_color_rings_pack___purple__10pcs__0000_1__2_.jpg,- No information
FITT190,EK-AF T-Splitter 3F G1/4 - Black,24 tháng,0,239000,Categories/img/Fan/250_37467_fitting_ek_af_t_splitter_3f_g14___black_0002_1__1_.jpg,"- EK-AF T-Splitter is a simple cube-shaped adapter fitting with 3 x G1/4"" BSP threads, useful for splitting or combining the liquid flow in your loop.."
FITT312,EK-Torque HTC-14 Color Rings Pack - Green (10pcs),24 tháng,0,419000,Categories/img/Fan/250_49658_ek_torque_htc_14_color_rings_pack___green__10pcs__0001_1__1_.jpg,- EK-Torque HTC 14 Color Rings Pack là các vòng màu thay đổi dành cho fitting 14mm mới của EK được thiết kế để sử dụng với ống cứng OD 14mm như Acrylic và PETG. Chúng được làm bằng nhôm anode.
FITT324,EK-AF Extender 8mm M-F G1/4 - Nickel,24 tháng,0,79000,Categories/img/Fan/250_49933_ek_af_extender_8mm_m_f_g14___nickel_0001_1__1_.jpg,- EK-AF Extender G1 / 4 phù hợp để nối dài ren G1/4 từ Block để gắn những fitting bị vướng bởi linh kiện hoặc dùng để nối dài ren.
ONGT024,EK-HD Tube 10/12mm 500mm (2 pcs),24 tháng,0,249000,Categories/img/Fan/250_37484_ekhd_500mm_1_800.jpg,- EK-HD Tube is solid type extruded acrylic tubing intended for use with EK-HD push-in adapters and EK-HDC series compression fittings. The tubing may be heat treated to achieve certain bends..- .- For expert users only!.
CABL176,Cáp nguồn Nối Dài 8 pin CPU 30cm màu Vàng / Đen,24 tháng,0,129000,Categories/img/Fan/250_26900_c__p_ngu___n_n___i_d__i_8_pin_cpu_30cm_m__u_v__ng____en.jpg,- No information
AIEK011,EK-Pro Manifold 2CPU 4GPU - Acetal,24 tháng,0,2999000,Categories/img/Fan/250_51378_ek_pro_manifold_2cpu_4gpu_acetal_1.jpg,"- EK-Pro Manifold là giải pháp điều hướng và phân tách nước cho các block trong hệ thống tản nhiệt nước. Nó đảm bảo việc phân tách nước hoàn hảo và đều đặn bằng cách sử dụng các cổng G1/4"" phổ thông. Có 2 phiên bản bao gồm 2CPU 2GPU hỗ trợ tối đa 2 CPU và 2 GPU như chính tên gọi trong setup tiếp nối hoặc song song. Phiên bản còn lại hỗ trợ 2 CPU và 4 GPU theo setup song song hoặc bán song song."
TOOL023,Filling Bottle (1000mL),24 tháng,0,239000,Categories/img/Fan/250_42189_filling_bottle_1000ml_1.jpg,"- A handy 1L filling bottle designed to make your loop filling process much easier. Very convenient for mixing the EK-CryoFuel concentrates with distilled water. The telescopic tube of the filling bottle can reach even the most remote and crammed fill ports. The squeeze bottle can also be used to suck out coolant out of your reservoir making system draining an easy task as well. Just squeeze the bottle, insert the tube into the coolant and let the vacuum take care of the rest.."
FITT112,Fitting Bitspower OD14 Deluxe White,24 tháng,0,269000,Categories/img/Fan/250_35606_bitspower_od14_deluxe_white_0000_1.jpg,- No information
FITT045,Fitting Barrow 45 chân ren fix  - Ice White,24 tháng,0,89000,Categories/img/Fan/250_29999_fitting_barrow_45_chan_ren_fix_ice_white_1.jpg,"- Fitting góc chếch 45*, dùng cho các góc cua từ linh kiện tản nhiệt.- Ren fix cứng, không thể xoay.- Bao gồm 1 ren female G1/4 và 1 ren male G1/4.- Sử dụng ren G1/4 phổ thông, tương thích 99% các linh kiện tản nước hiện tại.- Màu trắng."
FITT151,Fitting Bitspower Adapter 45* Male-Female Rotary Silver Shining. ,24 tháng,0,319000,Categories/img/Fan/250_36206_bitspower_adapter_45_male_female_rotary_silver_shining_0000_1.jpg,- No information
FITT038,Fitting Barrow Male-Male Rotary 10mm Deluxe White ,24 tháng,0,109000,Categories/img/Fan/250_29992_fitting_barrow_male_male_rotary_10mm_deluxe_white_1.jpg,"- Fitting dùng để gia tăng khoảng cách giữa các linh kiện, ví dụ như giữa bơm và tank chứa nước.- Bao gồm 2 ren G1/4 male có thể xoay 360*.- Sử dụng ren G1/4 phổ thông, tương thích 99% các linh kiện tản nước hiện tại.- Màu trắng."
FANC612,Tản nhiệt khí DeepCool Gamer Storm FRYZEN (AMD ONLY) - RGB Air Cooler,24 tháng,2249000,1899000,Categories/img/Fan/250_45675_tan_nhiet_khi_deepcool_gamer_storm_fryzen_amd_only_rgb_air_cooler_0002_1__1_.jpg,- Chữ X được lên đèn RGB cực phong cách.- Đèn led RGB tương thích nhiều hệ thống.- Bộ tản được làm bằng nhôm nguyên khối cao cấp.- 6 ống đồng tản nhiệt nhanh và hiệu quả.- Quạt cánh đôi 120mm gia tăng áp lực đến 2 lần.
FANC722,Tản nhiệt khí Jonsbo CR-1200,24 tháng,359000,289000,Categories/img/Fan/250_51070_tan_nhiet_khi_jonsbo_cr_1200_0004_5.jpg,"- Tản nhiệt dạng tháp với 2 ống dẫn nhiệt.- Quạt đi kèm 9mm tốc độ cao, trang bị đèn RGB.- Thiết kế nhỏ gọn, phù hợp với các máy kích thước nhỏ và vừa."
FANC777,Tản Nhiệt CPU ID-COOLING SE-224-XT WHITE,24 tháng,889000,689000,Categories/img/Fan/250_55588_tan_nhiet_cpu_se_224_xt_white_1.jpg,- No information
FANS192,Tản nhiệt SSD EK-M.2 NVMe Heatsink - Black,24 tháng,0,259000,Categories/img/Fan/250_38396_tan_nhiet_ssd_ek_m_2_nvme_heatsink___black_0002_3.jpg,- EK-M.2 NVMe Heatsink là đế tản nhiệt thụ động được thiết kế dành riêng cho các SSD M.2 thế hệ mới. Sản phẩm mang tính đột phá về hiệu năng và thẩm mỹ cho người dùng..
FANA477,Fan Case Freezemod Extreme Digital RGB ( 3 pcs / pack ),24 tháng,699000,649000,Categories/img/Fan/250_42737_fan_case_freezemod_extreme_digital_rgb_3_pcs_pack_1.jpg,- No information
FANA565,Fan Case Vitra Luna A-RGB AURA SYNC 3 IN 1 (3 Fan Pack / Kèm điều khiển),24 tháng,549000,449000,Categories/img/Fan/250_54081_fan_case_vitra_luna_argb__1_.jpg,"- Fan Case Vitra Luna ARGB ( 3 Fan Pack / Kèm điều khiển) là bộ quạt tản nhiệt cao cấp với đèn RGB bắt mắt, rất đẹp mắt khi dùng để trang trí case máy tính. Đồng thời Vitra Luna ARGB còn đem lại hiệu năng tản nhiệt tốt, phù hợp với các cấu hình chơi game cao cấp..- Một gói sản phẩm bao gồm 3 chiếc quạt tản nhiệt. Điều khiển màu sắc thông qua điều khiển riêng biệt."
KEOT004,Kem tản nhiệt Deepcool Z3 (Xi lanh). ,24 tháng,0,109000,Categories/img/Fan/250_802_kem_tan_nhiet_deepcool_z3_xi_lanh.png,- - Độ dẫn nhiệt tốt hơn .- - Không dễ cháy. .- - Hiệu năng tốt trong tầm giá .- - Không chứa bất kỳ kim loại hoặc vật liệu dẫn điện khác..
KEOT053,Keo Tản Nhiệt Arctic MX-4 - 8Gam,24 tháng,299000,189000,Categories/img/Fan/250_54978_keo_tan_nhiet_arctic_mx_4_8gam.jpg,- No information
